{"$schema":"https://json-schema.org/draft/2020-12/schema","additionalProperties":false,"properties":{"adr":{},"boundaries":{},"decision_criteria":{"minItems":6,"type":"array"},"decision_timing":{},"defect_id":{"const":"WS6-CONSIST-009"},"evidence_required":{"minItems":6,"type":"array"},"generated_from":{"const":"configs/workstream6-phase0-licence-decision-placeholder.yaml"},"licence_state":{},"options":{"maxItems":4,"minItems":4,"type":"array"},"owner":{"const":"Founder"},"rollback":{},"schema_version":{"const":1},"source_sha256":{"pattern":"^[0-9a-f]{64}$","type":"string"},"status":{"const":"decision_required_not_authorized"},"supplement_id":{"const":"WS6.13-LICENCE-PLACEHOLDER"},"title":{"minLength":1,"type":"string"},"work_package_id":{"const":"WS6.13"}},"required":["schema_version","work_package_id","supplement_id","title","defect_id","status","owner","decision_timing","options","decision_criteria","evidence_required","adr","licence_state","boundaries","rollback","generated_from","source_sha256"],"type":"object"}
