{"adr":{"approved":false,"exists":false,"planned_path":"docs/adr/ADR-0001-licence-decision.md","template":"templates/adr.md"},"boundaries":{"autonomous_merge_authorized":false,"codex_start_authorized":false,"external_actions_authorized":false,"founder_accountability_preserved":true,"oauth_authorized":false,"paid_services_authorized":false,"phase0_implementation_authorized":false,"phase0_merge_authorized":false,"production_deployment_authorized":false,"real_client_data_enabled":false,"runtime_activation_authorized":false},"decision_criteria":["intended_distribution_model","third_party_dependency_licence_compatibility","commercial_and_contribution_model","patent_and_trademark_considerations","client_confidentiality_and_proprietary_material_boundaries","legal_review_need"],"decision_timing":{"implementation_task":"P0.1","not_required_to_start_repository_only_planning":true,"required_before":["public_distribution","external_licence_notice","production_release"]},"defect_id":"WS6-CONSIST-009","evidence_required":["explicit_founder_decision","selected_licence_identifier_or_proprietary_status","decision_date","decision_scope","dependency_compatibility_review","adr_record"],"generated_from":"configs/workstream6-phase0-licence-decision-placeholder.yaml","licence_state":{"external_licence_notice_authorized":false,"implicit_licence_grant":false,"public_distribution_authorized":false,"selected_licence":null},"options":[{"id":"LIC-OPT-01","name":"proprietary_or_all_rights_reserved","selection":false},{"id":"LIC-OPT-02","name":"permissive_open_source","selection":false},{"id":"LIC-OPT-03","name":"copyleft_open_source","selection":false},{"id":"LIC-OPT-04","name":"dual_or_custom_licensing","selection":false}],"owner":"Founder","rollback":{"after_merge":"Revert the placeholder supplement as one unit while preserving the absence of an implicit licence grant.","before_merge":"Remove only the WS6.13 licence placeholder supplement if inaccurate; do not infer or grant a licence."},"schema_version":1,"source_sha256":"5a551ef4019139cf818497948c91af253a837ebe91a0338e8ff0ac02efc51ace","status":"decision_required_not_authorized","supplement_id":"WS6.13-LICENCE-PLACEHOLDER","title":"Phase 0 licence decision placeholder","work_package_id":"WS6.13"}
